<?xml version="1.0" encoding="UTF-8" ?>
<person xmlns="localhost" xmlns:xsi="http://www.w3.org/2001/XMLSchema-instance" xsi:schemaLocation="localhost person.xsd">

	<fullname>
		<firstname>hello</firstname>
		<lastname>world</lastname>
	</fullname>
	<gender>
		<female>女</female>
		<female>女</female>
		<female>女</female>
		<female>女</female>
		<female>女</female>
	</gender>
	<course>
		<java>java</java>
		<JavaScript>javascript</JavaScript>
		<XML>xml</XML>
	</course>
	<letter>
		<a></a>
		<b></b>
		<c></c>
	</letter>
	<content id=""/>
</person>